{"$schema":"https://json-schema.org/draft/2020-12/schema","$id":"https://filmfoundry.dev/schemas/voice-passport.v2.json","type":"object","additionalProperties":false,"required":["voice_id","voice_description","sample_asset_ids","accent","pitch","pace","emotional_behavior","test_lines","version","drift_observations","evidence_level"],"properties":{"voice_id":{"type":"string"},"voice_description":{"type":"string"},"sample_asset_ids":{"type":"array"},"accent":{"type":"string"},"pitch":{"type":"string"},"pace":{"type":"string"},"emotional_behavior":{"type":"string"},"test_lines":{"type":"array"},"version":{"type":"string"},"drift_observations":{"type":"array"},"evidence_level":{"type":"string"},"extensions":{"type":"object"}}}
